{
  "$schema": "https://json-schema.org/draft/2020-12/schema",
  "$id": "sdlc-analysis-evidence-ledger-v1",
  "title": "SDLC Analysis Evidence Ledger",
  "description": "One entry per number a filled diagnostic deck shows, tracing it to a metric in metrics.json, the datasets it was computed from, and the records it cites. Written by the report-analyst agent next to the deck; checked by scripts/verify-report against the deck, metrics.json and the run's sidecars. Prose contract: docs/report-contract.md section 4.",

  "type": "object",
  "required": ["schema", "run_id", "deck_file", "compute_script", "metrics_file", "datasets_used", "lower_bound_datasets", "unavailable_datasets", "staleness_exclusions", "claims", "diagnoses"],
  "properties": {

    "schema": { "const": "sdlc-analysis-evidence-ledger-v1" },

    "run_id": { "type": "string", "minLength": 1, "description": "The run directory's basename, as _run-manifest.json records it." },

    "deck_file": { "type": "string", "pattern": "\\.html$", "description": "The filled deck's filename, relative to report/." },
    "compute_script": { "type": "string", "pattern": "\\.mjs$", "description": "The deterministic metrics script, relative to report/." },
    "metrics_file": { "type": "string", "pattern": "\\.json$", "description": "The captured stdout of compute_script, relative to report/." },

    "datasets_used": { "$ref": "#/$defs/datasetIdList", "description": "Every dataset any claim was computed from." },
    "lower_bound_datasets": { "$ref": "#/$defs/datasetIdList", "description": "Exactly the truncated sidecars that appear in some claim's datasets. Copied from disk, never decided." },
    "unavailable_datasets": { "$ref": "#/$defs/datasetIdList", "description": "Exactly the unavailable sidecars in the run. Copied from disk." },

    "staleness_exclusions": {
      "type": "array",
      "description": "Scope units the template's staleness filter removed before aggregation. Empty when nothing was excluded — never omitted.",
      "items": {
        "type": "object",
        "required": ["domain", "unit", "evidence", "disclosed_as"],
        "properties": {
          "domain": { "type": "string", "enum": ["a", "b", "c", "d"] },
          "unit": { "type": "string", "minLength": 1, "description": "The provider-native id or name of the excluded repository, pipeline, board or service." },
          "last_activity": { "type": "string", "description": "The unit's last recorded activity as the records show it, verbatim. Absent when the records carry none." },
          "evidence": { "type": "string", "minLength": 1, "description": "Which datasets showed no activity and over what span." },
          "disclosed_as": { "type": "string", "minLength": 1, "description": "The exact text the deck's appendix uses to name this exclusion, normally the unit itself." }
        },
        "additionalProperties": false
      }
    },

    "claims": {
      "type": "array",
      "minItems": 1,
      "items": {
        "type": "object",
        "required": ["id", "rendered", "metric", "value", "datasets", "method", "lower_bound"],
        "properties": {
          "id": { "type": "string", "pattern": "^[a-z0-9]+(?:[.-][a-z0-9]+)*$", "description": "Stable lowercase id, dot- or dash-separated, matching the deck element's data-claim attribute." },
          "rendered": { "type": "string", "minLength": 1, "description": "The exact visible text of the deck element, whitespace collapsed." },
          "metric": { "type": "string", "pattern": "^[A-Za-z0-9_]+(?:\\.[A-Za-z0-9_]+)*$", "description": "Dot path into metrics.json; array indices are numeric segments." },
          "value": { "type": ["number", "string"], "description": "What the metric path holds. A number must be rendered faithfully; a string must appear in rendered verbatim." },
          "datasets": { "$ref": "#/$defs/datasetIdList", "minItems": 1 },
          "population": { "type": "integer", "minimum": 0, "description": "The denominator or record count behind the value, when one exists." },
          "method": { "type": "string", "minLength": 1, "description": "One sentence a skeptic could re-implement from." },
          "lower_bound": { "type": "boolean", "description": "True exactly when any of datasets is truncated in its sidecar." },
          "receipts": { "type": "array", "items": { "type": "string", "minLength": 1 }, "description": "Provider-native ids the claim's exhibit cites; each must occur verbatim in one of the claim's records files." }
        },
        "additionalProperties": false
      }
    },

    "diagnoses": {
      "type": "array",
      "minItems": 1,
      "description": "One root-cause diagnosis per finding the deck presents, following docs/root-cause-method.md: the symptom, the competing hypotheses and how the records decided each, the root cause, and the remedies that act on it.",
      "items": {
        "type": "object",
        "required": ["finding", "symptom", "symptom_claims", "hypotheses", "root_cause", "remedies"],
        "properties": {
          "finding": { "type": "string", "minLength": 1, "description": "The finding this diagnosis explains, as the deck's kicker names it (e.g. \"Finding 1\")." },
          "symptom": { "type": "string", "minLength": 1, "description": "One sentence: what is wrong, where, and by how much." },
          "symptom_claims": { "$ref": "#/$defs/claimIdList", "minItems": 1 },
          "hypotheses": {
            "type": "array",
            "minItems": 3,
            "items": {
              "type": "object",
              "required": ["id", "family", "cause", "prediction", "verdict", "claims"],
              "properties": {
                "id": { "type": "string", "pattern": "^[a-z0-9]+(?:[.-][a-z0-9]+)*$" },
                "family": { "type": "string", "enum": ["demand", "quality", "wait", "size", "capacity", "definition", "gate"] },
                "cause": { "type": "string", "minLength": 1, "description": "The candidate cause, one sentence." },
                "prediction": { "type": "string", "minLength": 1, "description": "What the records show if this is the cause, and what they show if it is not." },
                "verdict": { "type": "string", "enum": ["supported", "refuted", "untestable"] },
                "claims": { "$ref": "#/$defs/claimIdList", "description": "The claims that decided the verdict. Required non-empty for supported and refuted; empty for untestable." },
                "needs": { "type": "string", "description": "For an untestable hypothesis: the dataset or evidence that would test it." }
              },
              "additionalProperties": false
            }
          },
          "root_cause": {
            "type": "object",
            "required": ["hypothesis", "rendered", "confidence", "boundary"],
            "properties": {
              "hypothesis": { "type": "string", "minLength": 1, "description": "The id of the hypothesis this root cause rests on." },
              "rendered": { "type": "string", "minLength": 1, "description": "The root cause exactly as the deck states it, whitespace collapsed." },
              "confidence": { "type": "string", "enum": ["supported", "inferred"] },
              "boundary": { "type": "string", "minLength": 1, "description": "Where the records stop explaining, phrased as the question to ask the team." }
            },
            "additionalProperties": false
          },
          "remedies": {
            "type": "array",
            "minItems": 1,
            "items": {
              "type": "object",
              "required": ["name", "kind", "acts_on", "how"],
              "properties": {
                "name": { "type": "string", "minLength": 1, "description": "The remedy as the deck names it. For kind anthara, the workflow name shown on the Anthara slide or sheet." },
                "kind": { "type": "string", "enum": ["anthara", "practice"] },
                "acts_on": { "type": "string", "enum": ["root_cause", "mechanism"], "description": "root_cause: removes or prevents the cause. mechanism: catches the cause's effect at its source, before it becomes the symptom." },
                "how": { "type": "string", "minLength": 1, "description": "One sentence: how this remedy breaks the chain." }
              },
              "additionalProperties": false
            }
          }
        },
        "additionalProperties": false
      }
    }
  },
  "additionalProperties": false,

  "$defs": {
    "datasetId": {
      "type": "string",
      "enum": [
        "a1", "a2", "a3", "a4", "a5", "a6", "a7",
        "b1", "b2", "b3", "b4", "b5",
        "c1", "c2", "c3", "c4", "c5", "c6",
        "d1", "d2", "d3", "d4", "d5", "d6"
      ]
    },
    "claimIdList": {
      "type": "array",
      "items": { "type": "string", "pattern": "^[a-z0-9]+(?:[.-][a-z0-9]+)*$" },
      "uniqueItems": true
    },
    "datasetIdList": {
      "type": "array",
      "items": { "$ref": "#/$defs/datasetId" },
      "uniqueItems": true
    }
  }
}
